{
  "$schema": "http://json-schema.org/draft-07/schema#",
  "type": "object",
  "required": ["model_id", "created_at", "spec_id", "measures", "dimensions"],
  "additionalProperties": false,
  "properties": {
    "model_id": { "type": "string" },
    "created_at": { "type": "string", "format": "date-time" },
    "spec_id": { "type": "string" },
    "measures": {
      "type": "array",
      "minItems": 1,
      "items": {
        "type": "object",
        "required": ["name", "dax", "format_string", "description", "home_table"],
        "additionalProperties": false,
        "properties": {
          "name": { "type": "string" },
          "dax": { "type": "string" },
          "format_string": { "type": "string" },
          "description": { "type": "string" },
          "home_table": { "type": "string" }
        }
      }
    },
    "dimensions": {
      "type": "array",
      "minItems": 1,
      "items": {
        "type": "object",
        "required": ["name", "source_table", "source_column", "data_type"],
        "additionalProperties": false,
        "properties": {
          "name": { "type": "string" },
          "source_table": { "type": "string" },
          "source_column": { "type": "string" },
          "data_type": { "type": "string" }
        }
      }
    },
    "relationships": {
      "type": "array",
      "items": {
        "type": "object",
        "required": ["from_table", "from_column", "to_table", "to_column", "cardinality", "cross_filter_direction"],
        "additionalProperties": false,
        "properties": {
          "from_table": { "type": "string" },
          "from_column": { "type": "string" },
          "to_table": { "type": "string" },
          "to_column": { "type": "string" },
          "cardinality": { "type": "string", "enum": ["1:1", "1:N", "N:1", "N:N"] },
          "cross_filter_direction": { "type": "string", "enum": ["single", "both"] }
        }
      }
    },
    "advisor_guidance": { "type": ["string", "null"] }
  }
}
