{
  "model_id": "retail_sales_v1",
  "created_at": "2026-06-15T00:00:00+00:00",
  "spec_id": "retail_req_v1",
  "measures": [
    {"name": "Net Revenue", "home_table": "Fact_Sales", "format_string": "\\$#,0", "description": "SUM(TotalAmount) - SUM(Discount)", "dax": "SUM('Fact_Sales'[TotalAmount]) - SUM('Fact_Sales'[Discount])"},
    {"name": "Gross Profit", "home_table": "Fact_Sales", "format_string": "\\$#,0", "description": "SUM(Profit)", "dax": "SUM('Fact_Sales'[Profit])"},
    {"name": "Profit Margin %", "home_table": "Fact_Sales", "format_string": "0.0%", "description": "Gross Profit / Net Revenue", "dax": "DIVIDE([Gross Profit], [Net Revenue])"},
    {"name": "Quantity Sold", "home_table": "Fact_Sales", "format_string": "#,0", "description": "SUM(Quantity)", "dax": "SUM('Fact_Sales'[Quantity])"},
    {"name": "Discount Rate %", "home_table": "Fact_Sales", "format_string": "0.0%", "description": "SUM(Discount) / SUM(TotalAmount)", "dax": "DIVIDE(SUM('Fact_Sales'[Discount]), SUM('Fact_Sales'[TotalAmount]))"},
    {"name": "Top Category Revenue", "home_table": "Fact_Sales", "format_string": "\\$#,0", "description": "Net Revenue of the top category", "dax": "MAXX(VALUES('Dim_Product'[Category]), [Net Revenue])"},
    {"name": "Active SKUs", "home_table": "Dim_Product", "format_string": "#,0", "description": "DISTINCTCOUNT ProductKey where IsActive", "dax": "CALCULATE(DISTINCTCOUNT('Dim_Product'[ProductKey]), 'Dim_Product'[IsActive] = TRUE())"},
    {"name": "Pct Rev Top10 SKUs", "home_table": "Fact_Sales", "format_string": "0.0%", "description": "Top-10 SKU share of Net Revenue (Pareto)", "dax": "DIVIDE([Net Revenue (Top 10 SKU)], [Net Revenue])"},
    {"name": "Avg Category Margin %", "home_table": "Fact_Sales", "format_string": "0.0%", "description": "Average Profit Margin % across categories", "dax": "AVERAGEX(VALUES('Dim_Product'[Category]), [Profit Margin %])"},
    {"name": "Cumulative Net Revenue %", "home_table": "Fact_Sales", "format_string": "0.0%", "description": "Running cumulative share of Net Revenue by product rank (Pareto line)", "dax": "DIVIDE([Running Net Revenue], [Net Revenue (All Products)])"}
  ],
  "dimensions": [
    {"name": "MonthName", "source_table": "Dim_Date", "source_column": "MonthName", "data_type": "string"},
    {"name": "Quarter", "source_table": "Dim_Date", "source_column": "Quarter", "data_type": "string"},
    {"name": "Year", "source_table": "Dim_Date", "source_column": "Year", "data_type": "int64"},
    {"name": "FullDate", "source_table": "Dim_Date", "source_column": "FullDate", "data_type": "dateTime"},
    {"name": "Category", "source_table": "Dim_Product", "source_column": "Category", "data_type": "string"},
    {"name": "SubCategory", "source_table": "Dim_Product", "source_column": "SubCategory", "data_type": "string"},
    {"name": "ProductName", "source_table": "Dim_Product", "source_column": "ProductName", "data_type": "string"},
    {"name": "Brand", "source_table": "Dim_Product", "source_column": "Brand", "data_type": "string"},
    {"name": "Country", "source_table": "Dim_Store", "source_column": "Country", "data_type": "string"},
    {"name": "State", "source_table": "Dim_Store", "source_column": "State", "data_type": "string"},
    {"name": "StoreType", "source_table": "Dim_Store", "source_column": "StoreType", "data_type": "string"},
    {"name": "MembershipTier", "source_table": "Dim_Customer", "source_column": "MembershipTier", "data_type": "string"}
  ],
  "relationships": [
    {"from_table": "Dim_Date", "from_column": "DateKey", "to_table": "Fact_Sales", "to_column": "DateKey", "cardinality": "1:N", "cross_filter_direction": "single"},
    {"from_table": "Dim_Customer", "from_column": "CustomerKey", "to_table": "Fact_Sales", "to_column": "CustomerKey", "cardinality": "1:N", "cross_filter_direction": "single"},
    {"from_table": "Dim_Product", "from_column": "ProductKey", "to_table": "Fact_Sales", "to_column": "ProductKey", "cardinality": "1:N", "cross_filter_direction": "single"},
    {"from_table": "Dim_Store", "from_column": "StoreKey", "to_table": "Fact_Sales", "to_column": "StoreKey", "cardinality": "1:N", "cross_filter_direction": "single"}
  ],
  "advisor_guidance": null
}
